{
  "absence_event_id": "d9cd0866-65ec-4992-ba66-9929ca041888",
  "expectation_id": "maternal-newborn-followup-001",
  "entity_id": "journey-person-001",
  "relation_id": "post-discharge-followup",
  "emitted_at": 15.0,
  "due_interval": [
    7.0,
    14.0
  ],
  "coverage_complete": true,
  "coverage_evidence": [
    {
      "source_id": "patient-portal",
      "start": 7.0,
      "end": 14.0,
      "healthy": true,
      "reason": ""
    }
  ],
  "support_valid": true,
  "compatibility_valid": true,
  "matching_event_count": 0,
  "exception_checked": true,
  "reason_codes": [
    "EXPECTED_EVENT_NOT_OBSERVED_WITH_VALID_COVERAGE"
  ],
  "confidence": {
    "value": 1.0,
    "method": "deterministic coverage and event-log check"
  },
  "predicate_version": "care-pathway-1.0",
  "schema_version": "1.0"
}
